slug,title,meal_type,protein_type,cuisine,servings,total_min,kcal,protein_g,fat_g,net_carbs_g,thai_easy,dairy_free,dairy_items
25-minute-baked-salmon-filets-with-lemon-and-garlic,25-Minute Baked Salmon Filets with Lemon and Garlic,dinner,seafood,American,4,25,289,38.1,15,0.7,True,True,
asian-keto-chicken-stir-fry-with-broccoli,Asian keto chicken stir-fry with broccoli,dinner,chicken,Asian,4,25,613,43,46,3,True,True,
bacon-wrapped-pork-tenderloin-no-sugar,Bacon Wrapped Pork Tenderloin - No Sugar!,dinner,pork,American,4,50,338,37.6,18.2,3.2,True,True,
caramelized-onion-and-bacon-pork-chops,Caramelized onion and bacon pork chops,dinner,beef,American,4,50,680,56,46,4,True,False,cream
classic-keto-hamburger,Classic keto hamburger,dinner,beef,American,4,85,1,62,83,-6,True,False,butter
coconut-curry-turmeric-chicken-whole30-anti-inflammatory,"Coconut Curry Turmeric Chicken (Whole30, Anti-Inflammatory)",dinner,chicken,Asian / American,4,42,591,26,49,9,True,True,
creamy-low-carb-tuscan-shrimp,Creamy low carb Tuscan shrimp,dinner,seafood,Keto,4,30,603,35,44,8,True,False,cream|butter|cheese|parmesan
crispy-cuban-roast-pork-lechon-asado,Crispy Cuban roast pork (Lechon asado),dinner,pork,Keto,6,560,912,59,70,4,True,True,
crispy-keto-chicken-thighs-with-lemon-butter-caper-sauce,Crispy keto chicken thighs with lemon butter caper sauce,side,chicken,Keto,4,45,654,38,53,2,True,False,butter
crispy-keto-tuna-burgers,Crispy keto tuna burgers,lunch,beef,American,4,15,722,39,58,6,True,True,
crustless-keto-broccoli-and-bacon-quiche,Crustless keto broccoli and bacon quiche,breakfast,pork,Keto,4,40,509,32,40,4,True,False,cream|butter|cheese|mozzarella
easiest-ever-slow-cooker-pulled-pork-keto-whole30,Easiest Ever Slow Cooker Pulled Pork (Keto + Whole30),dinner,chicken,American,8,485,315,43,13,2,True,True,
easy-keto-chicken-piccata-with-lemon-caper-sauce,Easy Keto Chicken Piccata with Lemon Caper Sauce,side,chicken,Italian,4,30,305,37,16.3,1.2,True,True,
easy-paleo-salmon-salad-bowls-whole30-keto,Easy Paleo Salmon Salad Bowls (Whole30 + Keto),dinner,seafood,American,4,30,470,36,32,5,True,True,
garlic-ginger-stir-fry-with-shrimp-and-cabbage,Garlic ginger stir-fry with shrimp and cabbage,dinner,seafood,Asian,2,30,389,38,20,5,True,True,
ginger-lime-salmon-gluten-free-whole30-paleo-gaps-aip-keto,"Ginger-Lime Salmon (Gluten-free, Whole30, Paleo, GAPS, AIP, Keto)",dinner,seafood,"American, Asian",5,30,168,25,18,3,True,True,
high-protein-turkey-breakfast-burger,High protein turkey breakfast burger,breakfast,beef,American,2,20,647,59,44,1,True,False,butter
indian-keto-chicken-korma,Indian keto chicken korma,dinner,chicken,Keto,4,45,436,34,31,2,True,False,yogurt|ghee
italian-keto-meatballs-with-mozzarella-cheese,Italian keto meatballs with mozzarella cheese,dinner,beef,Italian,4,50,628,39,49,2,True,False,butter|cheese|parmesan|mozzarella
kerala-style-chicken-curry-with-coconut-cream,Kerala style chicken curry with coconut cream,dinner,chicken,Keto,4,30,613,34,50,5,True,True,
keto-asian-beef-salad,Keto Asian beef salad,lunch,beef,Asian,2,25,789,48,61,8,True,True,
keto-asian-chicken-with-peanut-coleslaw,Keto Asian chicken with peanut coleslaw,dinner,chicken,Asian,4,50,987,44,84,4,True,True,
keto-asian-meatballs-with-thai-basil-sauce,Keto Asian meatballs with Thai basil sauce,side,pork,Asian,4,40,868,29,79,4,True,False,butter
keto-bacon-and-eggs-plate,Keto bacon and eggs plate,breakfast,pork,Keto,2,15,937,42,78,-7,True,True,
keto-bacon-burger-casserole,Keto bacon burger casserole,dinner,beef,American,4,45,936,57,74,6,True,False,cream|cheese|cheddar
keto-baked-salmon-with-lemon-and-butter,Keto baked salmon with lemon and butter,dinner,seafood,Keto,6,35,574,31,49,1,True,False,butter
keto-beef-ramen,Keto beef ramen,dinner,beef,Keto,4,50,763,52,57,5,True,True,
keto-buffalo-chicken-with-paprika-mayo-and-butter-fried-cabbage,Keto Buffalo chicken with paprika mayo and butter-fried cabbage,dinner,chicken,Keto,4,60,856,41,71,3,True,False,butter
keto-butter-chicken-wings,Keto butter chicken wings,dinner,chicken,Keto,4,85,687,44,53,4,False,False,cream cheese|cream|butter|cheese|yogurt|ghee
keto-caprese-chicken,Keto Caprese chicken,dinner,chicken,Keto,4,50,460,52,24,4,True,False,cheese|mozzarella
keto-cheese-burger-meatloaf-with-bbq-mayo,Keto cheese-burger meatloaf with BBQ mayo,dinner,beef,American,4,70,913,58,69,7,True,False,cheese|cheddar
keto-cheesy-chicken-spaghetti-squash,Keto cheesy chicken spaghetti squash,dinner,chicken,Keto,4,65,679,36,57,6,False,False,cream cheese|cream|butter|cheese|parmesan|mozzarella
keto-chicken-blt-salad,Keto chicken BLT salad,dinner,chicken,Keto,4,25,702,43,56,2,True,False,butter
keto-chicken-cordon-bleu,Keto chicken Cordon Bleu,dinner,chicken,French,4,30,737,53,56,1,True,False,butter|cheese
keto-chicken-fajita-bowl,Keto chicken fajita bowl,dinner,chicken,Keto,4,35,583,53,36,0,True,False,butter|cheese|cheddar
keto-chicken-garam-masala,Keto chicken garam masala,dinner,chicken,Indian,4,50,471,29,38,2,True,False,butter
keto-chicken-pesto-stew-with-zoodles,Keto chicken pesto stew with zoodles,dinner,chicken,Mediterranean,4,30,546,38,40,5,True,False,cream|butter
keto-chicken-wings-with-creamy-broccoli,Keto chicken wings with creamy broccoli,dinner,chicken,Keto,4,50,858,55,65,4,True,True,
keto-coconut-curry-chicken,Keto coconut curry chicken,dinner,chicken,Keto,4,40,721,50,54,3,True,True,
keto-coconut-salmon-with-napa-cabbage,Keto coconut salmon with Napa cabbage,dinner,seafood,Keto,4,30,767,33,68,0,True,False,butter
keto-crack-chicken,Keto crack chicken,dinner,chicken,Keto,6,190,537,50,35,4,False,False,cream cheese|cream|cheese|cheddar
keto-egg-roll-in-a-bowl,Keto egg roll in a bowl,dinner,turkey,Asian,4,30,653,41,51,4,True,True,
keto-fried-chicken-with-broccoli-and-butter,Keto fried chicken with broccoli and butter,dinner,chicken,Keto,4,35,570,48,38,3,True,False,butter
keto-fried-salmon-with-broccoli-and-lemon-mayo,Keto fried salmon with broccoli and lemon mayo,dinner,seafood,Keto,4,25,780,44,63,2,True,False,butter
keto-garlic-mushroom-chicken-thighs,Keto garlic mushroom chicken thighs,dinner,chicken,Keto,4,30,704,44,56,4,True,False,cream|butter|cheese|parmesan
keto-goat-cheese-and-mushroom-frittata,Keto goat cheese and mushroom frittata,breakfast,egg,Keto,2,30,774,35,67,1,True,False,butter|cheese|goat cheese
keto-ground-beef-and-broccoli,Keto ground beef and broccoli,dinner,beef,Keto,2,20,638,47,46,2,True,False,butter
keto-hamburger-patties-with-creamy-tomato-sauce-and-fried-cabbage,Keto hamburger patties with creamy tomato sauce and fried cabbage,side,beef,American,4,40,685,41,52,5,True,False,cream|butter|cheese|feta
keto-indian-butter-chicken,Keto Indian butter chicken,dinner,chicken,Keto,6,60,497,33,37,3,True,False,cream|butter
keto-lasagna,Keto lasagna,dinner,beef,Italian,6,110,752,41,60,0,False,False,cream cheese|cream|cheese|parmesan|mozzarella|sour cream
keto-lemon-garlic-butter-salmon-with-almonds-and-chili,Keto lemon garlic butter salmon with almonds and chili,dinner,seafood,Keto,4,55,889,42,76,4,False,False,cream cheese|cream|butter|cheese
keto-mexican-scrambled-eggs,Keto Mexican scrambled eggs,breakfast,egg,Mexican,2,10,447,26,35,3,True,False,butter|cheese
keto-no-noodle-chicken-soup,Keto no-noodle chicken soup,lunch,chicken,Keto,8,30,508,33,40,3,True,False,butter
keto-pesto-chicken-casserole-with-feta-cheese-and-olives,Keto pesto chicken casserole with feta cheese and olives,dinner,chicken,Mediterranean,4,45,737,43,60,4,True,False,cream|butter|cheese|feta
keto-pork-and-green-pepper-stir-fry,Keto pork and green pepper stir-fry,lunch,pork,Asian,2,20,875,31,81,2,True,False,butter
keto-pork-chops-with-blue-cheese-sauce,Keto pork chops with blue cheese sauce,lunch,pork,Keto,4,20,780,54,60,3,True,False,cream|butter|cheese|blue cheese
keto-pulled-pork-with-roasted-tomato-salad,Keto pulled pork with roasted tomato salad,dinner,pork,Keto,6,270,788,32,68,-3,True,True,
keto-ribeye-steak-with-oven-roasted-vegetables,Keto ribeye steak with oven-roasted vegetables,dinner,beef,Keto,4,40,701,37,57,7,True,False,butter
keto-roast-chicken-with-broccoli-and-garlic-butter,Keto roast chicken with broccoli and garlic butter,dinner,chicken,Keto,4,55,889,51,72,3,True,False,butter
keto-salmon-burgers-with-mash-and-lemon-butter,Keto salmon burgers with mash and lemon butter,lunch,beef,Keto,4,40,811,44,67,4,True,False,butter|cheese|parmesan
keto-salmon-patties-paleo-whole30,Keto Salmon Patties (Paleo + Whole30),dinner,seafood,American,6,25,485,29,40,3,True,True,
keto-seared-salmon-with-creamy-lemon-sauce,Keto seared salmon with creamy lemon sauce,side,seafood,Keto,2,40,976,56,80,2,True,False,cream|butter
keto-sesame-salmon-with-thai-curry-cabbage,Keto sesame salmon with Thai curry cabbage,dinner,seafood,Thai,4,45,986,52,79,3,True,True,
keto-shepherds-pie,Keto shepherd's pie,dessert,lamb,Keto,4,40,958,51,78,6,True,False,cream|butter|cheese|cheddar|sour cream
keto-steak-with-barnaise-sauce,Keto steak with béarnaise sauce,side,beef,Keto,4,25,1,49,92,5,True,False,butter
keto-taco-omelet,Keto taco omelet,breakfast,beef,Keto,2,25,790,44,63,0,True,False,cheese|cheddar
keto-thai-fish-curry,Keto Thai fish curry,dinner,seafood,Keto,4,30,614,40,47,5,True,True,
keto-tuna-salad-with-boiled-eggs,Keto tuna salad with boiled eggs,lunch,seafood,Keto,2,15,614,33,50,2,True,True,
keto-western-omelet,Keto Western omelet,breakfast,pork,Keto,2,15,708,40,58,5,True,False,cream|butter|cheese|cheddar|sour cream
low-carb-beef-stroganoff,Low carb beef stroganoff,dinner,beef,Keto,4,30,770,40,63,9,True,False,cream|butter|cheese|blue cheese|sour cream
low-carb-garlic-chicken,Low carb garlic chicken,dinner,chicken,Italian,4,45,487,42,33,2,True,False,butter
paleo-buffalo-chicken-casserole-with-ranch-and-cauliflower-rice-whole30-low-carb,"Paleo Buffalo Chicken Casserole with Ranch and Cauliflower Rice (Whole30, Low Carb)",dinner,chicken,American,4,35,660,25,57,9,True,False,cream
paleo-pork-chops-with-mushroom-sauce-whole30,Paleo Pork Chops with Mushroom Sauce (Whole30),side,chicken,American,4,45,302,32,16,6,True,True,
salmon-taco-bowls-paleo-whole30,"Salmon Taco Bowls (Paleo, Whole30)",dinner,seafood,"American, Mexican",4,35,736,35,62,5,True,True,
spicy-pork-bowls-paleo-whole30-low-carb,"Spicy Pork Bowls (Paleo, Whole30 + Low Carb)",dinner,pork,"American, Asian",5,20,581,35,42,11,True,True,
teriyaki-salmon-whole30,Teriyaki Salmon (Whole30),dinner,seafood,"American, Japanese",4,20,339,34,18,7,True,True,
thai-chicken-with-satay-sauce-and-broccoli,Thai chicken with satay sauce and broccoli,side,chicken,Thai,4,40,774,47,59,9,True,True,
thai-peanut-curry-with-chicken-keto,Thai Peanut Curry with Chicken | Keto,dinner,chicken,"Asian, Thai",5,20,367,25,31,3,True,True,
whole30-bang-bang-shrimp-paleo-grain-free-nut-free,"Whole30 Bang Bang Shrimp (Paleo, Grain Free, Nut Free)",dinner,seafood,Thai,4,20,434,28,22,20,True,True,
whole30-instant-pot-chicken-tortilla-less-soup-with-slow-cooker-option,Whole30 Instant Pot Chicken Tortilla-Less Soup (with Slow Cooker Option),dinner,chicken,"American, Mexican",4,60,453,34,28,15,True,True,
whole30-keto-pork-chops-with-bacon-mushroom-sauce,Whole30 + Keto Pork Chops with Bacon Mushroom Sauce,side,chicken,American,4,30,462,57.4,21.7,5.6,True,False,cream
whole30-keto-salmon-with-lemon-garlic-aioli,Whole30 + Keto Salmon with Lemon Garlic Aioli,dinner,seafood,American,4,12,299,37,14.2,3.5,True,True,
whole30-marry-me-chicken,Whole30 Marry Me Chicken,dinner,chicken,American,4,50,321,35,15,14,True,True,
